{
  "schema_version": "0.2",
  "generated_at": "2026-10-01",
  "policy_version": "0.1.0",
  "skills": [
    {
      "id": "anthropics/frontend-design",
      "publisher": "Anthropic",
      "name": "frontend-design",
      "source": {
        "repo": "anthropics/skills",
        "path": "skills/frontend-design"
      },
      "category": [
        "agents",
        "engineering"
      ],
      "license": {
        "spdx": "Apache-2.0",
        "redistributable": true,
        "status": "verified",
        "evidence": "skill-level license metadata / upstream LICENSE"
      },
      "distribution": "bundled",
      "compatibility": [
        "agent-skills",
        "claude-code",
        "codex",
        "cursor"
      ],
      "security": {
        "network": false,
        "shell": false,
        "credentials": false,
        "packageInstall": false,
        "filesystemWrite": false
      }
    },
    {
      "id": "anthropics/skill-creator",
      "publisher": "Anthropic",
      "name": "skill-creator",
      "source": {
        "repo": "anthropics/skills",
        "path": "skills/skill-creator"
      },
      "category": [
        "agents",
        "engineering"
      ],
      "license": {
        "spdx": "Apache-2.0",
        "redistributable": true,
        "status": "verified",
        "evidence": "skill-level license metadata / upstream LICENSE"
      },
      "distribution": "bundled",
      "compatibility": [
        "agent-skills",
        "claude-code",
        "codex",
        "cursor"
      ],
      "security": {
        "network": false,
        "shell": false,
        "credentials": false,
        "packageInstall": false,
        "filesystemWrite": false
      }
    },
    {
      "id": "anthropics/mcp-builder",
      "publisher": "Anthropic",
      "name": "mcp-builder",
      "source": {
        "repo": "anthropics/skills",
        "path": "skills/mcp-builder"
      },
      "category": [
        "agents",
        "engineering"
      ],
      "license": {
        "spdx": "Apache-2.0",
        "redistributable": true,
        "status": "verified",
        "evidence": "skill-level license metadata / upstream LICENSE"
      },
      "distribution": "bundled",
      "compatibility": [
        "agent-skills",
        "claude-code",
        "codex",
        "cursor"
      ],
      "security": {
        "network": false,
        "shell": true,
        "credentials": false,
        "packageInstall": false,
        "filesystemWrite": false
      }
    },
    {
      "id": "anthropics/webapp-testing",
      "publisher": "Anthropic",
      "name": "webapp-testing",
      "source": {
        "repo": "anthropics/skills",
        "path": "skills/webapp-testing"
      },
      "category": [
        "agents",
        "engineering"
      ],
      "license": {
        "spdx": "Apache-2.0",
        "redistributable": true,
        "status": "verified",
        "evidence": "skill-level license metadata / upstream LICENSE"
      },
      "distribution": "bundled",
      "compatibility": [
        "agent-skills",
        "claude-code",
        "codex",
        "cursor"
      ],
      "security": {
        "network": false,
        "shell": true,
        "credentials": false,
        "packageInstall": false,
        "filesystemWrite": false
      }
    },
    {
      "id": "anthropics/docx",
      "publisher": "Anthropic",
      "name": "docx",
      "source": {
        "repo": "anthropics/skills",
        "path": "skills/docx"
      },
      "category": [
        "documents"
      ],
      "license": {
        "spdx": "Proprietary",
        "redistributable": false,
        "status": "verified",
        "evidence": "upstream skill LICENSE"
      },
      "distribution": "source-direct",
      "compatibility": [
        "agent-skills",
        "claude-code"
      ],
      "security": {
        "network": false,
        "shell": false,
        "credentials": false,
        "packageInstall": false,
        "filesystemWrite": false
      }
    },
    {
      "id": "anthropics/pdf",
      "publisher": "Anthropic",
      "name": "pdf",
      "source": {
        "repo": "anthropics/skills",
        "path": "skills/pdf"
      },
      "category": [
        "documents"
      ],
      "license": {
        "spdx": "Proprietary",
        "redistributable": false,
        "status": "verified",
        "evidence": "upstream skill LICENSE"
      },
      "distribution": "source-direct",
      "compatibility": [
        "agent-skills",
        "claude-code"
      ],
      "security": {
        "network": false,
        "shell": false,
        "credentials": false,
        "packageInstall": false,
        "filesystemWrite": false
      }
    },
    {
      "id": "anthropics/pptx",
      "publisher": "Anthropic",
      "name": "pptx",
      "source": {
        "repo": "anthropics/skills",
        "path": "skills/pptx"
      },
      "category": [
        "documents"
      ],
      "license": {
        "spdx": "Proprietary",
        "redistributable": false,
        "status": "verified",
        "evidence": "upstream skill LICENSE"
      },
      "distribution": "source-direct",
      "compatibility": [
        "agent-skills",
        "claude-code"
      ],
      "security": {
        "network": false,
        "shell": false,
        "credentials": false,
        "packageInstall": false,
        "filesystemWrite": false
      }
    },
    {
      "id": "anthropics/xlsx",
      "publisher": "Anthropic",
      "name": "xlsx",
      "source": {
        "repo": "anthropics/skills",
        "path": "skills/xlsx"
      },
      "category": [
        "documents"
      ],
      "license": {
        "spdx": "Proprietary",
        "redistributable": false,
        "status": "verified",
        "evidence": "upstream skill LICENSE"
      },
      "distribution": "source-direct",
      "compatibility": [
        "agent-skills",
        "claude-code"
      ],
      "security": {
        "network": false,
        "shell": false,
        "credentials": false,
        "packageInstall": false,
        "filesystemWrite": false
      }
    },
    {
      "id": "obra/superpowers/brainstorming",
      "publisher": "obra/Superpowers",
      "name": "brainstorming",
      "source": {
        "repo": "obra/superpowers",
        "path": "skills/brainstorming"
      },
      "category": [
        "workflow",
        "engineering"
      ],
      "license": {
        "spdx": "MIT",
        "redistributable": true,
        "status": "verified",
        "evidence": "repository LICENSE + upstream plugin manifest"
      },
      "distribution": "bundled",
      "compatibility": [
        "agent-skills",
        "claude-code",
        "codex",
        "cursor",
        "opencode"
      ],
      "security": {
        "network": false,
        "shell": false,
        "credentials": false,
        "packageInstall": false,
        "filesystemWrite": false
      }
    },
    {
      "id": "obra/superpowers/writing-plans",
      "publisher": "obra/Superpowers",
      "name": "writing-plans",
      "source": {
        "repo": "obra/superpowers",
        "path": "skills/writing-plans"
      },
      "category": [
        "workflow",
        "engineering"
      ],
      "license": {
        "spdx": "MIT",
        "redistributable": true,
        "status": "verified",
        "evidence": "repository LICENSE + upstream plugin manifest"
      },
      "distribution": "bundled",
      "compatibility": [
        "agent-skills",
        "claude-code",
        "codex",
        "cursor",
        "opencode"
      ],
      "security": {
        "network": false,
        "shell": false,
        "credentials": false,
        "packageInstall": false,
        "filesystemWrite": false
      }
    },
    {
      "id": "obra/superpowers/executing-plans",
      "publisher": "obra/Superpowers",
      "name": "executing-plans",
      "source": {
        "repo": "obra/superpowers",
        "path": "skills/executing-plans"
      },
      "category": [
        "workflow",
        "engineering"
      ],
      "license": {
        "spdx": "MIT",
        "redistributable": true,
        "status": "verified",
        "evidence": "repository LICENSE + upstream plugin manifest"
      },
      "distribution": "bundled",
      "compatibility": [
        "agent-skills",
        "claude-code",
        "codex",
        "cursor",
        "opencode"
      ],
      "security": {
        "network": false,
        "shell": false,
        "credentials": false,
        "packageInstall": false,
        "filesystemWrite": false
      }
    },
    {
      "id": "obra/superpowers/systematic-debugging",
      "publisher": "obra/Superpowers",
      "name": "systematic-debugging",
      "source": {
        "repo": "obra/superpowers",
        "path": "skills/systematic-debugging"
      },
      "category": [
        "workflow",
        "engineering"
      ],
      "license": {
        "spdx": "MIT",
        "redistributable": true,
        "status": "verified",
        "evidence": "repository LICENSE + upstream plugin manifest"
      },
      "distribution": "bundled",
      "compatibility": [
        "agent-skills",
        "claude-code",
        "codex",
        "cursor",
        "opencode"
      ],
      "security": {
        "network": false,
        "shell": false,
        "credentials": false,
        "packageInstall": false,
        "filesystemWrite": false
      }
    },
    {
      "id": "obra/superpowers/test-driven-development",
      "publisher": "obra/Superpowers",
      "name": "test-driven-development",
      "source": {
        "repo": "obra/superpowers",
        "path": "skills/test-driven-development"
      },
      "category": [
        "workflow",
        "engineering"
      ],
      "license": {
        "spdx": "MIT",
        "redistributable": true,
        "status": "verified",
        "evidence": "repository LICENSE + upstream plugin manifest"
      },
      "distribution": "bundled",